{
  "schema_version": 1,
  "descriptor": {"family": "naca-four-digit-v1", "naca": "0012", "chord": 2.5, "pivot": [0.3, -0.4]},
  "surface_x": [0.0, 0.625, 1.25, 2.5],
  "surface_upper": [0.0, 0.14851875, 0.13215375500142895, -4.163336342344337e-17],
  "surface_lower": [0.0, -0.14851875, -0.13215375500142895, 4.163336342344337e-17],
  "angle_degrees": 23.0,
  "points": [[-1.0, -0.4], [0.3, -0.4], [1.2, 0.1], [2.8, 0.6]],
  "signed_distance": [0.7647251879857134, -0.14851875, 0.008040169570667749, 0.8189323946752839],
  "normals": [[-0.9476403826122582, 0.3193394827491474], [-0.39073112848927377, 0.9205048534524404], [-0.3038832882241744, 0.952709266848005], [0.9451981724432912, 0.32649718958953117]],
  "contains": [false, true, false, false],
  "angular_velocity_degrees": 120.0,
  "wall_velocity": [[0.0, -2.722713633111154], [0.0, 0.0], [-1.0471975511965976, 1.8849555921538756], [-2.0943951023931953, 5.235987755982988]],
  "maximum_radius": 1.8812320431036678,
  "absolute_tolerances": {"surface": 1e-12, "signed_distance": 1e-10, "normal": 2e-6, "wall_velocity": 1e-12, "radius": 1e-12}
}
